# name: test/sql/test_multipolygon.test
# description: MULTIPOLYGON tests
# group: [sql]

statement ok
LOAD 'build/release/extension/geo/geo.duckdb_extension';

statement ok
PRAGMA enable_verification

statement ok
CREATE TABLE geographies (g Geography);

# Insert valid geometry strings
statement ok
INSERT INTO geographies VALUES('01060000000200000001030000000100000004000000a2252261afc651c039f9ab389b2b45409ba30861afc651c09da44e389b2b454034cc8465afc651c0e875b0339b2b4540a2252261afc651c039f9ab389b2b45400103000000010000000f000000a2252261afc651c039f9ab389b2b4540f4ad4ce6afc651c0129491d59c2b4540a8bf447bb0c651c0236ed8329e2b45406945a5f1b0c651c0349ec5289f2b45403a2a6b21b1c651c0f89186869f2b45400a431fcbb1c651c02c1eb28fa02b454049703f0fb2c651c06ff11ce4a02b4540adf5e800b6c651c099cb4d7ba52b45400cfbd13fb6c651c0aeb760c1a52b45400115577bb6c651c01b39792aa62b45408f9c2186aec651c0a8343363b52b4540f7291766a7c651c0c2b9441bad2b4540337de93ba4c651c0aada5c12a82b454039a7def2aec651c0d80cf4b59b2b4540a2252261afc651c039f9ab389b2b4540'), ('010500000002000000010200000002000000CEDF8442046F56C0FE463B6EF87D3F401895D409684656C0B81E85EB51383F40010200000002000000CEDF8442046F56C0FE463B6EF87D3F40EFFFE384096F56C093E1783E037E3F40'), ('01060000000100000001030000000100000039000000b4c876be9fba51c09487855ad30c454094f6065f98bc51c0ce1951da1b0c4540d122dbf97ebe51c0091b9e5e290b45402d211ff46cbe51c033333333330b4540b537f8c264be51c0c1a8a44e400b4540cac342ad69be51c088635ddc460b45402d211ff46cbe51c06c09f9a0670b4540f5dbd78173be51c096218e75710b4540a60a462575be51c0c139234a7b0b4540a60a462575be51c088f4dbd7810b45402d211ff46cbe51c0b30c71ac8b0b4540917efb3a70be51c04182e2c7980b45407cf2b0506bbe51c0a4dfbe0e9c0b45407cf2b0506bbe51c088855ad3bc0b454043ad69de71be51c0401361c3d30b4540df4f8d976ebe51c0ce88d2dee00b4540df4f8d976ebe51c040a4dfbe0e0c45401895d40968be51c095d40968220c4540df4f8d976ebe51c087a757ca320c45401895d40968be51c0787aa52c430c45401895d40968be51c007f01648500c4540a60a462575be51c031992a18950c45403480b74082be51c0bf0e9c33a20c4540e6ae25e483be51c04d840d4faf0c4540fb3a70ce88be51c0a2b437f8c20c4540fb3a70ce88be51c0f7e461a1d60c4540e6ae25e483be51c0be9f1a2fdd0c45404a0c022b87be51c014d044d8f00c45408351499d80be51c030bb270f0b0d4540e6ae25e483be51c0e9482eff210d454098dd938785be51c0a1d634ef380d4540c3f5285c8fbe51c0211ff46c560d45405f984c158cbe51c0857cd0b3590d4540742497ff90be51c0857cd0b3590d4540d881734694be51c0764f1e166a0d45405f984c158cbe51c05af5b9da8a0d454011c7bab88dbe51c0840d4faf940d45408ab0e1e995be51c01283c0caa10d45409f3c2cd49abe51c02041f163cc0d4540ca54c1a8a4be51c0d9cef753e30d4540bb270f0bb5be51c0a089b0e1e90d4540499d8026c2be51c0cba145b6f30d4540fbcbeec9c3be51c0f5b9da8afd0d4540499d8026c2be51c04bea0434110e45405f29cb10c7be51c02e90a0f8310e4540adfa5c6dc5be51c058a835cd3b0e4540bb270f0bb5be51c0e71da7e8480e4540910f7a36abbe51c02d211ff46c0e45402db29defa7be51c0f5dbd781730e454018265305a3be51c0e6ae25e4830e45402db29defa7be51c0d8817346940e4540dfe00b93a9be51c09f3c2cd49a0e4540f9a067b3eabf51c0e71da7e8480e45404703780b24c051c0f163cc5d4b104540ea04341136bc51c041f163cc5d134540560e2db29dbb51c0f4fdd478e90e4540b4c876be9fba51c09487855ad30c4540'), ('01060000000200000001030000000100000004000000a2252261afc651c039f9ab389b2b45409ba30861afc651c09da44e389b2b454034cc8465afc651c0e875b0339b2b4540a2252261afc651c039f9ab389b2b45400103000000010000000f000000a2252261afc651c039f9ab389b2b4540f4ad4ce6afc651c0129491d59c2b4540a8bf447bb0c651c0236ed8329e2b45406945a5f1b0c651c0349ec5289f2b45403a2a6b21b1c651c0f89186869f2b45400a431fcbb1c651c02c1eb28fa02b454049703f0fb2c651c06ff11ce4a02b4540adf5e800b6c651c099cb4d7ba52b45400cfbd13fb6c651c0aeb760c1a52b45400115577bb6c651c01b39792aa62b45408f9c2186aec651c0a8343363b52b4540f7291766a7c651c0c2b9441bad2b4540337de93ba4c651c0aada5c12a82b454039a7def2aec651c0d80cf4b59b2b4540a2252261afc651c039f9ab389b2b4540')

query T
SELECT * FROM geographies
----
0106000020E61000000200000001030000000100000004000000A2252261AFC651C039F9AB389B2B45409BA30861AFC651C09DA44E389B2B454034CC8465AFC651C0E875B0339B2B4540A2252261AFC651C039F9AB389B2B45400103000000010000000F000000A2252261AFC651C039F9AB389B2B4540F4AD4CE6AFC651C0129491D59C2B4540A8BF447BB0C651C0236ED8329E2B45406945A5F1B0C651C0349EC5289F2B45403A2A6B21B1C651C0F89186869F2B45400A431FCBB1C651C02C1EB28FA02B454049703F0FB2C651C06FF11CE4A02B4540ADF5E800B6C651C099CB4D7BA52B45400CFBD13FB6C651C0AEB760C1A52B45400115577BB6C651C01B39792AA62B45408F9C2186AEC651C0A8343363B52B4540F7291766A7C651C0C2B9441BAD2B4540337DE93BA4C651C0AADA5C12A82B454039A7DEF2AEC651C0D80CF4B59B2B4540A2252261AFC651C039F9AB389B2B4540
0105000020E610000002000000010200000002000000CEDF8442046F56C0FE463B6EF87D3F401895D409684656C0B81E85EB51383F40010200000002000000CEDF8442046F56C0FE463B6EF87D3F40EFFFE384096F56C093E1783E037E3F40
0106000020E61000000100000001030000000100000039000000B4C876BE9FBA51C09487855AD30C454094F6065F98BC51C0CE1951DA1B0C4540D122DBF97EBE51C0091B9E5E290B45402D211FF46CBE51C033333333330B4540B537F8C264BE51C0C1A8A44E400B4540CAC342AD69BE51C088635DDC460B45402D211FF46CBE51C06C09F9A0670B4540F5DBD78173BE51C096218E75710B4540A60A462575BE51C0C139234A7B0B4540A60A462575BE51C088F4DBD7810B45402D211FF46CBE51C0B30C71AC8B0B4540917EFB3A70BE51C04182E2C7980B45407CF2B0506BBE51C0A4DFBE0E9C0B45407CF2B0506BBE51C088855AD3BC0B454043AD69DE71BE51C0401361C3D30B4540DF4F8D976EBE51C0CE88D2DEE00B4540DF4F8D976EBE51C040A4DFBE0E0C45401895D40968BE51C095D40968220C4540DF4F8D976EBE51C087A757CA320C45401895D40968BE51C0787AA52C430C45401895D40968BE51C007F01648500C4540A60A462575BE51C031992A18950C45403480B74082BE51C0BF0E9C33A20C4540E6AE25E483BE51C04D840D4FAF0C4540FB3A70CE88BE51C0A2B437F8C20C4540FB3A70CE88BE51C0F7E461A1D60C4540E6AE25E483BE51C0BE9F1A2FDD0C45404A0C022B87BE51C014D044D8F00C45408351499D80BE51C030BB270F0B0D4540E6AE25E483BE51C0E9482EFF210D454098DD938785BE51C0A1D634EF380D4540C3F5285C8FBE51C0211FF46C560D45405F984C158CBE51C0857CD0B3590D4540742497FF90BE51C0857CD0B3590D4540D881734694BE51C0764F1E166A0D45405F984C158CBE51C05AF5B9DA8A0D454011C7BAB88DBE51C0840D4FAF940D45408AB0E1E995BE51C01283C0CAA10D45409F3C2CD49ABE51C02041F163CC0D4540CA54C1A8A4BE51C0D9CEF753E30D4540BB270F0BB5BE51C0A089B0E1E90D4540499D8026C2BE51C0CBA145B6F30D4540FBCBEEC9C3BE51C0F5B9DA8AFD0D4540499D8026C2BE51C04BEA0434110E45405F29CB10C7BE51C02E90A0F8310E4540ADFA5C6DC5BE51C058A835CD3B0E4540BB270F0BB5BE51C0E71DA7E8480E4540910F7A36ABBE51C02D211FF46C0E45402DB29DEFA7BE51C0F5DBD781730E454018265305A3BE51C0E6AE25E4830E45402DB29DEFA7BE51C0D8817346940E4540DFE00B93A9BE51C09F3C2CD49A0E4540F9A067B3EABF51C0E71DA7E8480E45404703780B24C051C0F163CC5D4B104540EA04341136BC51C041F163CC5D134540560E2DB29DBB51C0F4FDD478E90E4540B4C876BE9FBA51C09487855AD30C4540
0106000020E61000000200000001030000000100000004000000A2252261AFC651C039F9AB389B2B45409BA30861AFC651C09DA44E389B2B454034CC8465AFC651C0E875B0339B2B4540A2252261AFC651C039F9AB389B2B45400103000000010000000F000000A2252261AFC651C039F9AB389B2B4540F4AD4CE6AFC651C0129491D59C2B4540A8BF447BB0C651C0236ED8329E2B45406945A5F1B0C651C0349EC5289F2B45403A2A6B21B1C651C0F89186869F2B45400A431FCBB1C651C02C1EB28FA02B454049703F0FB2C651C06FF11CE4A02B4540ADF5E800B6C651C099CB4D7BA52B45400CFBD13FB6C651C0AEB760C1A52B45400115577BB6C651C01B39792AA62B45408F9C2186AEC651C0A8343363B52B4540F7291766A7C651C0C2B9441BAD2B4540337DE93BA4C651C0AADA5C12A82B454039A7DEF2AEC651C0D80CF4B59B2B4540A2252261AFC651C039F9AB389B2B4540

query T
SELECT ST_ASTEXT(g) FROM geographies
----
MULTIPOLYGON(((-71.1044543107478 42.340674480411,-71.1044542869917 42.3406744369506,-71.1044553562977 42.340673886454,-71.1044543107478 42.340674480411)),((-71.1044543107478 42.340674480411,-71.1044860600303 42.3407237015564,-71.1045215770124 42.3407653385914,-71.1045498002983 42.3407946553165,-71.1045611902745 42.3408058316308,-71.1046016507427 42.340837442371,-71.104617893173 42.3408475056957,-71.1048586153981 42.3409875993595,-71.1048736143677 42.3409959528211,-71.1048878050242 42.3410084812078,-71.1044020965803 42.3414730072048,-71.1039672113619 42.3412202916693,-71.1037740497748 42.3410666421308,-71.1044280218456 42.3406894151355,-71.1044543107478 42.340674480411)))
MULTILINESTRING((-89.734635 31.492072,-89.1001 31.22),(-89.734635 31.492072,-89.734956 31.492237))
MULTIPOLYGON(((-70.916 42.1002,-70.9468 42.0946,-70.9765 42.0872,-70.9754 42.0875,-70.9749 42.0879,-70.9752 42.0881,-70.9754 42.0891,-70.9758 42.0894,-70.9759 42.0897,-70.9759 42.0899,-70.9754 42.0902,-70.9756 42.0906,-70.9753 42.0907,-70.9753 42.0917,-70.9757 42.0924,-70.9755 42.0928,-70.9755 42.0942,-70.9751 42.0948,-70.9755 42.0953,-70.9751 42.0958,-70.9751 42.0962,-70.9759 42.0983,-70.9767 42.0987,-70.9768 42.0991,-70.9771 42.0997,-70.9771 42.1003,-70.9768 42.1005,-70.977 42.1011,-70.9766 42.1019,-70.9768 42.1026,-70.9769 42.1033,-70.9775 42.1042,-70.9773 42.1043,-70.9776 42.1043,-70.9778 42.1048,-70.9773 42.1058,-70.9774 42.1061,-70.9779 42.1065,-70.9782 42.1078,-70.9788 42.1085,-70.9798 42.1087,-70.9806 42.109,-70.9807 42.1093,-70.9806 42.1099,-70.9809 42.1109,-70.9808 42.1112,-70.9798 42.1116,-70.9792 42.1127,-70.979 42.1129,-70.9787 42.1134,-70.979 42.1139,-70.9791 42.1141,-70.9987 42.1116,-71.0022 42.1273,-70.9408 42.1513,-70.9315 42.1165,-70.916 42.1002)))
MULTIPOLYGON(((-71.1044543107478 42.340674480411,-71.1044542869917 42.3406744369506,-71.1044553562977 42.340673886454,-71.1044543107478 42.340674480411)),((-71.1044543107478 42.340674480411,-71.1044860600303 42.3407237015564,-71.1045215770124 42.3407653385914,-71.1045498002983 42.3407946553165,-71.1045611902745 42.3408058316308,-71.1046016507427 42.340837442371,-71.104617893173 42.3408475056957,-71.1048586153981 42.3409875993595,-71.1048736143677 42.3409959528211,-71.1048878050242 42.3410084812078,-71.1044020965803 42.3414730072048,-71.1039672113619 42.3412202916693,-71.1037740497748 42.3410666421308,-71.1044280218456 42.3406894151355,-71.1044543107478 42.340674480411)))

statement error
INSERT INTO geographies(('010600000002000000010300000001000000230000000000000000406740000000000040684000000000006067400000000000406840000000000080674000000000006068400000000000A0674000000000006068400000000000C0674000000000006068400000000000E067400000000000606840000000000000684000000000006068400000000000206840000000000040684000000000004068400000000000406840000000000040684000000000002068400000000000606840000000000000684000000000006068400000000000E0674000000000006068400000000000C0674000000000006068400000000000A067400000000000606840000000000080674000000000004068400000000000606740000000000040684000000000004067400000000000002C4000000000000018400000000000002A40000000000000184000000000000028400000000000001440000000000000264000000000000014400000000000002440000000000000144000000000000022400000000000001440000000000000204000000000000014400000000000001C4000000000000018400000000000001840000000000000184000000000000018400000000000001C40000000000000144000000000000020400000000000001440000000000000224000000000000014400000000000002440000000000000144000000000000026400000000000001440000000000000284000000000000018400000000000002A4000000000000018400000000000002C4000000000004067400000000000406840010300000001000000210000000000000000C0624000000000008056400000000000A06240000000000000544000000000004062400000000000C051400000000000C061400000000000004F400000000000E060400000000000804B40000000000000604000000000000048400000000000C05D4000000000000046400000000000805B4000000000008044400000000000005940000000000000444000000000008056400000000000804440000000000040544000000000000046400000000000005240000000000000484000000000004050400000000000804B400000000000004D400000000000004F400000000000004B400000000000C051400000000000804940000000000000544000000000000049400000000000805640000000000080494000000000000059400000000000004B400000000000405B400000000000004D400000000000805D4000000000004050400000000000405F40000000000000524000000000008060400000000000405440000000000000614000000000008056400000000000606140000000000000594000000000008061400000000000805B4000000000006061400000000000C05D400000000000006140000000000000604000000000008060400000000000E060400000000000405F400000000000C061400000000000805D4000000000004062400000000000405B400000000000A0624000000000000059400000000000C06240000000000080564011'))

# Insert valid strings with text
statement ok
DELETE FROM geographies

statement ok
INSERT INTO geographies VALUES('MULTIPOLYGON(((-71.1044543107478 42.340674480411,-71.1044542869917 42.3406744369506,-71.1044553562977 42.340673886454,-71.1044543107478 42.340674480411)),((-71.1044543107478 42.340674480411,-71.1044860600303 42.3407237015564,-71.1045215770124 42.3407653385914,-71.1045498002983 42.3407946553165,-71.1045611902745 42.3408058316308,-71.1046016507427 42.340837442371,-71.104617893173 42.3408475056957,-71.1048586153981 42.3409875993595,-71.1048736143677 42.3409959528211,-71.1048878050242 42.3410084812078,-71.1044020965803 42.3414730072048,-71.1039672113619 42.3412202916693,-71.1037740497748 42.3410666421308,-71.1044280218456 42.3406894151355,-71.1044543107478 42.340674480411)))'), ('MULTIPOLYGON(((-70.916 42.1002,-70.9468 42.0946,-70.9765 42.0872,-70.9754 42.0875,-70.9749 42.0879,-70.9752 42.0881,-70.9754 42.0891,-70.9758 42.0894,-70.9759 42.0897,-70.9759 42.0899,-70.9754 42.0902,-70.9756 42.0906,-70.9753 42.0907,-70.9753 42.0917,-70.9757 42.0924,-70.9755 42.0928,-70.9755 42.0942,-70.9751 42.0948,-70.9755 42.0953,-70.9751 42.0958,-70.9751 42.0962,-70.9759 42.0983,-70.9767 42.0987,-70.9768 42.0991,-70.9771 42.0997,-70.9771 42.1003,-70.9768 42.1005,-70.977 42.1011,-70.9766 42.1019,-70.9768 42.1026,-70.9769 42.1033,-70.9775 42.1042,-70.9773 42.1043,-70.9776 42.1043,-70.9778 42.1048,-70.9773 42.1058,-70.9774 42.1061,-70.9779 42.1065,-70.9782 42.1078,-70.9788 42.1085,-70.9798 42.1087,-70.9806 42.109,-70.9807 42.1093,-70.9806 42.1099,-70.9809 42.1109,-70.9808 42.1112,-70.9798 42.1116,-70.9792 42.1127,-70.979 42.1129,-70.9787 42.1134,-70.979 42.1139,-70.9791 42.1141,-70.9987 42.1116,-71.0022 42.1273,-70.9408 42.1513,-70.9315 42.1165,-70.916 42.1002)))'), ('MULTIPOLYGON(((-71.0821 42.3036 2,-71.0822 42.3036 2,-71.082 42.3038 2,-71.0819 42.3037 2,-71.0821 42.3036 2)))')

query T
SELECT * FROM geographies
----
0106000020E61000000200000001030000000100000004000000A2252261AFC651C039F9AB389B2B45409BA30861AFC651C09DA44E389B2B454034CC8465AFC651C0E875B0339B2B4540A2252261AFC651C039F9AB389B2B45400103000000010000000F000000A2252261AFC651C039F9AB389B2B4540F4AD4CE6AFC651C0129491D59C2B4540A8BF447BB0C651C0236ED8329E2B45406945A5F1B0C651C0349EC5289F2B45403A2A6B21B1C651C0F89186869F2B45400A431FCBB1C651C02C1EB28FA02B454049703F0FB2C651C06FF11CE4A02B4540ADF5E800B6C651C099CB4D7BA52B45400CFBD13FB6C651C0AEB760C1A52B45400115577BB6C651C01B39792AA62B45408F9C2186AEC651C0A8343363B52B4540F7291766A7C651C0C2B9441BAD2B4540337DE93BA4C651C0AADA5C12A82B454039A7DEF2AEC651C0D80CF4B59B2B4540A2252261AFC651C039F9AB389B2B4540
0106000020E61000000100000001030000000100000039000000B4C876BE9FBA51C09487855AD30C454094F6065F98BC51C0CE1951DA1B0C4540D122DBF97EBE51C0091B9E5E290B45402D211FF46CBE51C033333333330B4540B537F8C264BE51C0C1A8A44E400B4540CAC342AD69BE51C088635DDC460B45402D211FF46CBE51C06C09F9A0670B4540F5DBD78173BE51C096218E75710B4540A60A462575BE51C0C139234A7B0B4540A60A462575BE51C088F4DBD7810B45402D211FF46CBE51C0B30C71AC8B0B4540917EFB3A70BE51C04182E2C7980B45407CF2B0506BBE51C0A4DFBE0E9C0B45407CF2B0506BBE51C088855AD3BC0B454043AD69DE71BE51C0401361C3D30B4540DF4F8D976EBE51C0CE88D2DEE00B4540DF4F8D976EBE51C040A4DFBE0E0C45401895D40968BE51C095D40968220C4540DF4F8D976EBE51C087A757CA320C45401895D40968BE51C0787AA52C430C45401895D40968BE51C007F01648500C4540A60A462575BE51C031992A18950C45403480B74082BE51C0BF0E9C33A20C4540E6AE25E483BE51C04D840D4FAF0C4540FB3A70CE88BE51C0A2B437F8C20C4540FB3A70CE88BE51C0F7E461A1D60C4540E6AE25E483BE51C0BE9F1A2FDD0C45404A0C022B87BE51C014D044D8F00C45408351499D80BE51C030BB270F0B0D4540E6AE25E483BE51C0E9482EFF210D454098DD938785BE51C0A1D634EF380D4540C3F5285C8FBE51C0211FF46C560D45405F984C158CBE51C0857CD0B3590D4540742497FF90BE51C0857CD0B3590D4540D881734694BE51C0764F1E166A0D45405F984C158CBE51C05AF5B9DA8A0D454011C7BAB88DBE51C0840D4FAF940D45408AB0E1E995BE51C01283C0CAA10D45409F3C2CD49ABE51C02041F163CC0D4540CA54C1A8A4BE51C0D9CEF753E30D4540BB270F0BB5BE51C0A089B0E1E90D4540499D8026C2BE51C0CBA145B6F30D4540FBCBEEC9C3BE51C0F5B9DA8AFD0D4540499D8026C2BE51C04BEA0434110E45405F29CB10C7BE51C02E90A0F8310E4540ADFA5C6DC5BE51C058A835CD3B0E4540BB270F0BB5BE51C0E71DA7E8480E4540910F7A36ABBE51C02D211FF46C0E45402DB29DEFA7BE51C0F5DBD781730E454018265305A3BE51C0E6AE25E4830E45402DB29DEFA7BE51C0D8817346940E4540DFE00B93A9BE51C09F3C2CD49A0E4540F9A067B3EABF51C0E71DA7E8480E45404703780B24C051C0F163CC5D4B104540EA04341136BC51C041F163CC5D134540560E2DB29DBB51C0F4FDD478E90E4540B4C876BE9FBA51C09487855AD30C4540
01060000A0E610000001000000010300008001000000050000001AC05B2041C551C06688635DDC2645400000000000000040CCEEC9C342C551C06688635DDC26454000000000000000406891ED7C3FC551C02D431CEBE22645400000000000000040B7627FD93DC551C0C9E53FA4DF26454000000000000000401AC05B2041C551C06688635DDC2645400000000000000040

query T
SELECT ST_ASTEXT(g) FROM geographies
----
MULTIPOLYGON(((-71.1044543107478 42.340674480411,-71.1044542869917 42.3406744369506,-71.1044553562977 42.340673886454,-71.1044543107478 42.340674480411)),((-71.1044543107478 42.340674480411,-71.1044860600303 42.3407237015564,-71.1045215770124 42.3407653385914,-71.1045498002983 42.3407946553165,-71.1045611902745 42.3408058316308,-71.1046016507427 42.340837442371,-71.104617893173 42.3408475056957,-71.1048586153981 42.3409875993595,-71.1048736143677 42.3409959528211,-71.1048878050242 42.3410084812078,-71.1044020965803 42.3414730072048,-71.1039672113619 42.3412202916693,-71.1037740497748 42.3410666421308,-71.1044280218456 42.3406894151355,-71.1044543107478 42.340674480411)))
MULTIPOLYGON(((-70.916 42.1002,-70.9468 42.0946,-70.9765 42.0872,-70.9754 42.0875,-70.9749 42.0879,-70.9752 42.0881,-70.9754 42.0891,-70.9758 42.0894,-70.9759 42.0897,-70.9759 42.0899,-70.9754 42.0902,-70.9756 42.0906,-70.9753 42.0907,-70.9753 42.0917,-70.9757 42.0924,-70.9755 42.0928,-70.9755 42.0942,-70.9751 42.0948,-70.9755 42.0953,-70.9751 42.0958,-70.9751 42.0962,-70.9759 42.0983,-70.9767 42.0987,-70.9768 42.0991,-70.9771 42.0997,-70.9771 42.1003,-70.9768 42.1005,-70.977 42.1011,-70.9766 42.1019,-70.9768 42.1026,-70.9769 42.1033,-70.9775 42.1042,-70.9773 42.1043,-70.9776 42.1043,-70.9778 42.1048,-70.9773 42.1058,-70.9774 42.1061,-70.9779 42.1065,-70.9782 42.1078,-70.9788 42.1085,-70.9798 42.1087,-70.9806 42.109,-70.9807 42.1093,-70.9806 42.1099,-70.9809 42.1109,-70.9808 42.1112,-70.9798 42.1116,-70.9792 42.1127,-70.979 42.1129,-70.9787 42.1134,-70.979 42.1139,-70.9791 42.1141,-70.9987 42.1116,-71.0022 42.1273,-70.9408 42.1513,-70.9315 42.1165,-70.916 42.1002)))
MULTIPOLYGON Z (((-71.0821 42.3036 2,-71.0822 42.3036 2,-71.082 42.3038 2,-71.0819 42.3037 2,-71.0821 42.3036 2)))

statement error
INSERT INTO geographies(('MULTIPOLYGON(-71.064544 42.28787)'))

# Insert valid strings with geojson
statement ok
DELETE FROM geographies

statement ok
INSERT INTO geographies VALUES('{"type":"MultiPolygon","coordinates":[[[[-117,32],[-117,32],[-117,32],[-117,32],[-117,32],[-117,32],[-117,32],[-117,32],[-117,32],[-117,32],[-117,32],[-117,32],[-117,32],[-117,33],[-117,33],[-117,33],[-117,33],[-117,33],[-117,33],[-117,33],[-117,33],[-117,33],[-117,33],[-117,33],[-117,33],[-117,32],[-117,32],[-117,32],[-117,32],[-116,32],[-116,32],[-116,32],[-116,32],[-116,32],[-116,32],[-116,32],[-116,32],[-116,32],[-116,32],[-117,32],[-117,32],[-117,32],[-117,32]],[[-117,33],[-117,33],[-117,33],[-117,33],[-117,33],[-117,32],[-117,33]]]]}'), ('{"type":"MultiPolygon","coordinates":[[[[4,0],[0,-4],[-4,0],[0,4],[4,0]],[[2,0],[0,2],[-2,0],[0,-2],[2,0]]],[[[24,0],[20,-4],[16,0],[20,4],[24,0]],[[22,0],[20,2],[18,0],[20,-2],[22,0]]],[[[44,0],[40,-4],[36,0],[40,4],[44,0]],[[42,0],[40,2],[38,0],[40,-2],[42,0]]]]}')

query T
SELECT * FROM geographies
----
0106000020E6100000010000000103000000020000002B0000000000000000405DC000000000000040400000000000405DC000000000000040400000000000405DC000000000000040400000000000405DC000000000000040400000000000405DC000000000000040400000000000405DC000000000000040400000000000405DC000000000000040400000000000405DC000000000000040400000000000405DC000000000000040400000000000405DC000000000000040400000000000405DC000000000000040400000000000405DC000000000000040400000000000405DC000000000000040400000000000405DC000000000008040400000000000405DC000000000008040400000000000405DC000000000008040400000000000405DC000000000008040400000000000405DC000000000008040400000000000405DC000000000008040400000000000405DC000000000008040400000000000405DC000000000008040400000000000405DC000000000008040400000000000405DC000000000008040400000000000405DC000000000008040400000000000405DC000000000008040400000000000405DC000000000000040400000000000405DC000000000000040400000000000405DC000000000000040400000000000405DC000000000000040400000000000005DC000000000000040400000000000005DC000000000000040400000000000005DC000000000000040400000000000005DC000000000000040400000000000005DC000000000000040400000000000005DC000000000000040400000000000005DC000000000000040400000000000005DC000000000000040400000000000005DC000000000000040400000000000005DC000000000000040400000000000405DC000000000000040400000000000405DC000000000000040400000000000405DC000000000000040400000000000405DC00000000000004040070000000000000000405DC000000000008040400000000000405DC000000000008040400000000000405DC000000000008040400000000000405DC000000000008040400000000000405DC000000000008040400000000000405DC000000000000040400000000000405DC00000000000804040
0106000020E6100000030000000103000000020000000500000000000000000010400000000000000000000000000000000000000000000010C000000000000010C00000000000000000000000000000000000000000000010400000000000001040000000000000000005000000000000000000004000000000000000000000000000000000000000000000004000000000000000C00000000000000000000000000000000000000000000000C0000000000000004000000000000000000103000000020000000500000000000000000038400000000000000000000000000000344000000000000010C000000000000030400000000000000000000000000000344000000000000010400000000000003840000000000000000005000000000000000000364000000000000000000000000000003440000000000000004000000000000032400000000000000000000000000000344000000000000000C0000000000000364000000000000000000103000000020000000500000000000000000046400000000000000000000000000000444000000000000010C000000000000042400000000000000000000000000000444000000000000010400000000000004640000000000000000005000000000000000000454000000000000000000000000000004440000000000000004000000000000043400000000000000000000000000000444000000000000000C000000000000045400000000000000000

query T
SELECT ST_ASTEXT(g) FROM geographies
----
MULTIPOLYGON(((-117 32,-117 32,-117 32,-117 32,-117 32,-117 32,-117 32,-117 32,-117 32,-117 32,-117 32,-117 32,-117 32,-117 33,-117 33,-117 33,-117 33,-117 33,-117 33,-117 33,-117 33,-117 33,-117 33,-117 33,-117 33,-117 32,-117 32,-117 32,-117 32,-116 32,-116 32,-116 32,-116 32,-116 32,-116 32,-116 32,-116 32,-116 32,-116 32,-117 32,-117 32,-117 32,-117 32),(-117 33,-117 33,-117 33,-117 33,-117 33,-117 32,-117 33)))
MULTIPOLYGON(((4 0,0 -4,-4 0,0 4,4 0),(2 0,0 2,-2 0,0 -2,2 0)),((24 0,20 -4,16 0,20 4,24 0),(22 0,20 2,18 0,20 -2,22 0)),((44 0,40 -4,36 0,40 4,44 0),(42 0,40 2,38 0,40 -2,42 0)))

# Insert invalid geojson string
statement error
INSERT INTO geographies(('{"type":"MultiPolygon","coordinates":[[30,10.2323]}'))
