# name: test/sql/function/test_geogfrom.test
# description: ST_GEOMFROM test
# group: [function]

statement ok
PRAGMA enable_verification

statement ok
CREATE TABLE geometries(g Geometry)

statement ok
INSERT INTO geometries VALUES(ST_GEOGFROM('0101000000295C8FC2F5281440E17A14AE47E12540')), (ST_GEOGFROM('{"type":"Point","coordinates":[-71.064544,10.2323]}')), (ST_GEOGFROM('POLYGON((-71.040878 42.285678,-71.040943 42.2856,-71.04096 42.285752,-71.040878 42.285678))')),(ST_GEOGFROM(NULL))

query R
select ST_ASTEXT(g) from geometries
----
POINT(5.04 10.94)
POINT(-71.064544 10.2323)
POLYGON((-71.040878 42.285678,-71.040943 42.2856,-71.04096 42.285752,-71.040878 42.285678))
NULL

# test with null and empty
statement ok
DELETE FROM geometries

statement ok
INSERT INTO geometries VALUES(''), (NULL)

query R
select ST_ASTEXT(g) from geometries
----
NULL
NULL

query I
SELECT ST_GEOGFROM('POINT(1 1)')
----
0101000000000000000000F03F000000000000F03F

query I
SELECT ST_GEOGFROM('{"type": "Point", "coordinates": [42, 42]}')
----
010100000000000000000045400000000000004540

query I
SELECT ST_ASTEXT(ST_GEOGFROM('0101000000000000000000F03F000000000000F03F'))
----
POINT(1 1)

query I
SELECT ST_GEOGFROM('MULTIPOINT(100 100 30, 50 74 1000)')
----
0104000080020000000101000080000000000000594000000000000059400000000000003E400101000080000000000000494000000000008052400000000000408F40

query I
SELECT ST_GEOGFROM('{"type":"MultiPoint","coordinates":[[35,14]]}')
----
010400000001000000010100000000000000008041400000000000002C40

query I
SELECT ST_ASTEXT(ST_GEOGFROM('0104000000060000000101000000cdccccccccccec3fcdccccccccccec3f0101000000cdccccccccccec3fcdccccccccccec3f0101000000cdccccccccccec3fcdccccccccccec3f0101000000cdccccccccccec3fcdccccccccccec3f0101000000cdccccccccccec3fcdccccccccccec3f0101000000cdccccccccccec3fcdccccccccccec3f'))
----
MULTIPOINT(0.9 0.9,0.9 0.9,0.9 0.9,0.9 0.9,0.9 0.9,0.9 0.9)

query I
SELECT ST_GEOGFROM('SRID=4326;LINESTRING(-72.1260 42.45, -72.1240 42.45666, -72.123 42.1546)')
----
0102000020E610000003000000F2D24D62100852C09A999999993945400E2DB29DEF0752C018B2BAD5733A45401D5A643BDF0752C016FBCBEEC9134540

query I
SELECT ST_GEOGFROM('{"type":"LineString","coordinates":[[1,1],[2,2],[3,3],[4,4]]}')
----
010200000004000000000000000000F03F000000000000F03F000000000000004000000000000000400000000000000840000000000000084000000000000010400000000000001040

query I
SELECT ST_ASTEXT(ST_GEOGFROM('010200000007000000000000004ac5264100000000207f464100000000c4c3264100000000f07e46410000000076c2264100000080c97e46410000000018c2264100000000ba7e464100000000e0c1264100000000ab7e464100000000b4c1264100000000907e4641000000009ac12641000000806f7e4641'))
----
LINESTRING(746149 2948672,745954 2948576,745787 2948499,745740 2948468,745712 2948438,745690 2948384,745677 2948319)

query I
SELECT ST_GEOGFROM('MULTILINESTRING((-118.584 38.374 20,-118.583 38.5 30),(-71.05957 42.3589 75, -71.061 43 90))')
----
0105000080020000000102000080020000004C37894160A55DC01D5A643BDF2F434000000000000034405A643BDF4FA55DC000000000004043400000000000003E40010200008002000000A774B0FECFC351C06744696FF02D45400000000000C0524096438B6CE7C351C000000000008045400000000000805640

query I
SELECT ST_GEOGFROM('{"type":"MultiLineString","coordinates":[[[-89.734634999999997,31.492072000000000],[-89.734955999999997,31.492237999999997]]]}')
----
010500000001000000010200000002000000CEDF8442046F56C0FE463B6EF87D3F40EFFFE384096F56C033D93F4F037E3F40

query I
SELECT ST_ASTEXT(ST_GEOGFROM('01050000C00200000001020000C004000000000000000000000000000000000000000000000000000000000000000000F03F00000000000000000000000000001440000000000000000000000000000000400000000000001440000000000000000000000000000000000000000000000840000000000000000000000000000000000000000000000000000000000000104001020000C004000000000000000000F03F000000000000F03F0000000000000000000000000000F03F0000000000000840000000000000F03F0000000000000000000000000000F03F000000000000F03F00000000000008400000000000000000000000000000F03F000000000000F03F000000000000F03F0000000000000000000000000000F03F'))
----
MULTILINESTRING ZM ((0 0 0 1,0 5 0 2,5 0 0 3,0 0 0 4),(1 1 0 1,3 1 0 1,1 3 0 1,1 1 0 1))

query I
SELECT ST_GEOGFROM('POLYGON((-71.17166 42.353675,-71.172026 42.354044,-71.17239 42.354358,-71.171794 42.354971,-71.170511 42.354855,-71.17112 42.354238,-71.17166 42.353675))')
----
010300000001000000070000000282397AFCCA51C0D734EF38452D4540F303577902CB51C02AAC5450512D4540130A117008CB51C0B9895A9A5B2D45408AE942ACFECA51C0A30392B06F2D4540EE26F8A6E9CA51C03AE97DE36B2D454042EC4CA1F3CA51C00F80B8AB572D45400282397AFCCA51C0D734EF38452D4540

query I
SELECT ST_GEOGFROM('{"type":"Polygon","coordinates":[[[0,0],[0,150],[150,150],[150,0],[0,0]],[[20,20],[50,20],[50,50],[20,50],[20,20]]]}')
----
010300000002000000050000000000000000000000000000000000000000000000000000000000000000C062400000000000C062400000000000C062400000000000C06240000000000000000000000000000000000000000000000000050000000000000000003440000000000000344000000000000049400000000000003440000000000000494000000000000049400000000000003440000000000000494000000000000034400000000000003440

query I
SELECT ST_ASTEXT(ST_GEOGFROM('010300000001000000210000009f9eb2d41bf360400000000000c05c4032d435e64fcc6040a9dd02d02eac59406ea475c8695960401f74b91ea4b65640aa5d4db3a73d5f40fd1cf7917cfc534044f2fd6f73475d40ca0d02908c9851400ae3086e83e35a4081446599b0444f40e88b46e15b295840496e29de585a4c404f22fd2fd133554039af2867c08e4a400700000000205240a08535ad90f349407dbb05a05d184e402aaf2867c08e4a404de8723d482d48403b6e29de585a4c40073aee23f9b8424073446599b0444f402837084032e23b40bc0d02908c9851401e89ca3261093440ef1cf7917cfc534024b9a57863692c401174b91ea4b65640e2bca29c013b2540a9dd02d02eac59407916d6b442ce22400000000000c05c40aabca29c013b25405722fd2fd1d35f40ebb8a57863692c40df45a3f0ad646140ca88ca3261093440857104b7c1c16240f036084032e23b4022f9feb7b9f36340cf39ee23f9b84240d5aea6d9d3ee644014e8723d482d48406ea475c869a9654053bb05a05d184e4032d435e64f1c6640f2ffffffff1f52409f9eb2d41b4366403a22fd2fd133554032d435e64f1c6640d38b46e15b2958406ea475c869a965400ae3086e83e35a40d5aea6d9d3ee644044f2fd6f73475d4022f9feb7b9f36340aa5d4db3a73d5f40857104b7c1c162406ea475c8695960400246a3f0ad64614032d435e64fcc60405722fd2fd1d35f409f9eb2d41bf360400000000000c05c40'))
----
POLYGON((135.59714732062 115,134.384753327498 102.690357210921,130.79416296937 90.8537670908995,124.963360620072 79.9451031602111,117.116420743937 70.3835792560632,107.554896839789 62.5366393799277,96.6462329091006 56.70583703063,84.8096427890789 53.115246672502,72.5000000000001 51.9028526793802,60.1903572109213 53.1152466725019,48.3537670908996 56.7058370306299,37.4451031602112 62.5366393799276,27.8835792560632 70.383579256063,20.0366393799278 79.9451031602109,14.20583703063 90.8537670908993,10.615246672502 102.690357210921,9.40285267938019 115,10.6152466725019 127.309642789079,14.2058370306299 139.1462329091,20.0366393799275 150.054896839789,27.883579256063 159.616420743937,37.4451031602108 167.463360620072,48.3537670908992 173.29416296937,60.190357210921 176.884753327498,72.4999999999998 178.09714732062,84.8096427890786 176.884753327498,96.6462329091003 173.29416296937,107.554896839789 167.463360620072,117.116420743937 159.616420743937,124.963360620072 150.054896839789,130.79416296937 139.146232909101,134.384753327498 127.309642789079,135.59714732062 115))

query I
SELECT ST_GEOGFROM('MULTIPOLYGON(((26 125,26 200,126 200,126 125,101 100,26 125),(51 150,101 150,76 175,51 150)),((151 100,151 200,176 175,151 100)))')
----
010600000002000000010300000002000000060000000000000000003A400000000000405F400000000000003A4000000000000069400000000000805F4000000000000069400000000000805F400000000000405F40000000000040594000000000000059400000000000003A400000000000405F400400000000000000008049400000000000C0624000000000004059400000000000C0624000000000000053400000000000E0654000000000008049400000000000C06240010300000001000000040000000000000000E0624000000000000059400000000000E06240000000000000694000000000000066400000000000E065400000000000E062400000000000005940

query I
SELECT ST_GEOGFROM('{"type":"MultiPolygon","coordinates":[[[[-117,32],[-117,32],[-117,32],[-117,32],[-117,32],[-117,32],[-117,32],[-117,32],[-117,32],[-117,32],[-117,32],[-117,32],[-117,32],[-117,33],[-117,33],[-117,33],[-117,33],[-117,33],[-117,33],[-117,33],[-117,33],[-117,33],[-117,33],[-117,33],[-117,33],[-117,32],[-117,32],[-117,32],[-117,32],[-116,32],[-116,32],[-116,32],[-116,32],[-116,32],[-116,32],[-116,32],[-116,32],[-116,32],[-116,32],[-117,32],[-117,32],[-117,32],[-117,32]],[[-117,33],[-117,33],[-117,33],[-117,33],[-117,33],[-117,32],[-117,33]]]]}')
----
0106000000010000000103000000020000002B0000000000000000405DC000000000000040400000000000405DC000000000000040400000000000405DC000000000000040400000000000405DC000000000000040400000000000405DC000000000000040400000000000405DC000000000000040400000000000405DC000000000000040400000000000405DC000000000000040400000000000405DC000000000000040400000000000405DC000000000000040400000000000405DC000000000000040400000000000405DC000000000000040400000000000405DC000000000000040400000000000405DC000000000008040400000000000405DC000000000008040400000000000405DC000000000008040400000000000405DC000000000008040400000000000405DC000000000008040400000000000405DC000000000008040400000000000405DC000000000008040400000000000405DC000000000008040400000000000405DC000000000008040400000000000405DC000000000008040400000000000405DC000000000008040400000000000405DC000000000008040400000000000405DC000000000000040400000000000405DC000000000000040400000000000405DC000000000000040400000000000405DC000000000000040400000000000005DC000000000000040400000000000005DC000000000000040400000000000005DC000000000000040400000000000005DC000000000000040400000000000005DC000000000000040400000000000005DC000000000000040400000000000005DC000000000000040400000000000005DC000000000000040400000000000005DC000000000000040400000000000005DC000000000000040400000000000405DC000000000000040400000000000405DC000000000000040400000000000405DC000000000000040400000000000405DC00000000000004040070000000000000000405DC000000000008040400000000000405DC000000000008040400000000000405DC000000000008040400000000000405DC000000000008040400000000000405DC000000000008040400000000000405DC000000000000040400000000000405DC00000000000804040

query I
SELECT ST_ASTEXT(ST_GEOGFROM('0106000000030000000103000000020000000500000000000000000010400000000000000000000000000000000000000000000010C000000000000010C00000000000000000000000000000000000000000000010400000000000001040000000000000000005000000000000000000004000000000000000000000000000000000000000000000004000000000000000C00000000000000000000000000000000000000000000000C0000000000000004000000000000000000103000000020000000500000000000000000038400000000000000000000000000000344000000000000010C000000000000030400000000000000000000000000000344000000000000010400000000000003840000000000000000005000000000000000000364000000000000000000000000000003440000000000000004000000000000032400000000000000000000000000000344000000000000000C0000000000000364000000000000000000103000000020000000500000000000000000046400000000000000000000000000000444000000000000010C000000000000042400000000000000000000000000000444000000000000010400000000000004640000000000000000005000000000000000000454000000000000000000000000000004440000000000000004000000000000043400000000000000000000000000000444000000000000000C000000000000045400000000000000000'))
----
MULTIPOLYGON(((4 0,0 -4,-4 0,0 4,4 0),(2 0,0 2,-2 0,0 -2,2 0)),((24 0,20 -4,16 0,20 4,24 0),(22 0,20 2,18 0,20 -2,22 0)),((44 0,40 -4,36 0,40 4,44 0),(42 0,40 2,38 0,40 -2,42 0)))

query I
SELECT ST_GEOGFROM('GEOMETRYCOLLECTION(POLYGON((-71.040878 42.285678,-71.040943 42.2856,-71.04096 42.285752,-71.040878 42.285678)),LINESTRING(-71.160281 42.258729,-71.160837 42.259113,-71.161144 42.25932))')
----
010700000002000000010300000001000000040000000F48C2BE9DC251C0E597C11891244540028063CF9EC251C06ADE718A8E2445406D1CB1169FC251C020628385932445400F48C2BE9DC251C0E597C11891244540010200000003000000E44A3D0B42CA51C06EC328081E21454027BF45274BCA51C0F67B629D2A214540957CEC2E50CA51C07099D36531214540

query I
SELECT ST_GEOGFROM('{"type":"GeometryCollection","geometries":[{"type":"MultiPoint","coordinates":[[-117,32],[-117,32],[-117,32],[-117,32],[-117,32],[-117,32],[-117,32],[-117,32],[-117,32],[-117,32],[-117,32],[-117,32],[-117,32],[-117,33],[-117,33],[-117,33],[-117,33],[-117,33],[-117,33],[-117,33],[-117,33],[-117,33],[-117,33],[-117,33],[-117,33],[-117,32],[-117,32],[-117,32],[-117,32],[-116,32],[-116,32],[-116,32],[-116,32],[-116,32],[-116,32],[-116,32],[-116,32],[-116,32],[-116,32],[-117,32],[-117,32],[-117,32],[-117,32]]},{"type":"MultiLineString","coordinates":[[[-89.734634999999997,31.492072000000000],[-89.734955999999997,31.492237999999997]]]},{"type":"MultiPolygon","coordinates":[[[[-117,32],[-117,32],[-117,32],[-117,32],[-117,32],[-117,32],[-117,32],[-117,32],[-117,32],[-117,32],[-117,32],[-117,32],[-117,32],[-117,33],[-117,33],[-117,33],[-117,33],[-117,33],[-117,33],[-117,33],[-117,33],[-117,33],[-117,33],[-117,33],[-117,33],[-117,32],[-117,32],[-117,32],[-117,32],[-116,32],[-116,32],[-116,32],[-116,32],[-116,32],[-116,32],[-116,32],[-116,32],[-116,32],[-116,32],[-117,32],[-117,32],[-117,32],[-117,32]],[[-117,33],[-117,33],[-117,33],[-117,33],[-117,33],[-117,32],[-117,33]]]]}]}')
----
01070000000300000001040000002B00000001010000000000000000405DC0000000000000404001010000000000000000405DC0000000000000404001010000000000000000405DC0000000000000404001010000000000000000405DC0000000000000404001010000000000000000405DC0000000000000404001010000000000000000405DC0000000000000404001010000000000000000405DC0000000000000404001010000000000000000405DC0000000000000404001010000000000000000405DC0000000000000404001010000000000000000405DC0000000000000404001010000000000000000405DC0000000000000404001010000000000000000405DC0000000000000404001010000000000000000405DC0000000000000404001010000000000000000405DC0000000000080404001010000000000000000405DC0000000000080404001010000000000000000405DC0000000000080404001010000000000000000405DC0000000000080404001010000000000000000405DC0000000000080404001010000000000000000405DC0000000000080404001010000000000000000405DC0000000000080404001010000000000000000405DC0000000000080404001010000000000000000405DC0000000000080404001010000000000000000405DC0000000000080404001010000000000000000405DC0000000000080404001010000000000000000405DC0000000000080404001010000000000000000405DC0000000000000404001010000000000000000405DC0000000000000404001010000000000000000405DC0000000000000404001010000000000000000405DC0000000000000404001010000000000000000005DC0000000000000404001010000000000000000005DC0000000000000404001010000000000000000005DC0000000000000404001010000000000000000005DC0000000000000404001010000000000000000005DC0000000000000404001010000000000000000005DC0000000000000404001010000000000000000005DC0000000000000404001010000000000000000005DC0000000000000404001010000000000000000005DC0000000000000404001010000000000000000005DC0000000000000404001010000000000000000405DC0000000000000404001010000000000000000405DC0000000000000404001010000000000000000405DC0000000000000404001010000000000000000405DC00000000000004040010500000001000000010200000002000000CEDF8442046F56C0FE463B6EF87D3F40EFFFE384096F56C033D93F4F037E3F400106000000010000000103000000020000002B0000000000000000405DC000000000000040400000000000405DC000000000000040400000000000405DC000000000000040400000000000405DC000000000000040400000000000405DC000000000000040400000000000405DC000000000000040400000000000405DC000000000000040400000000000405DC000000000000040400000000000405DC000000000000040400000000000405DC000000000000040400000000000405DC000000000000040400000000000405DC000000000000040400000000000405DC000000000000040400000000000405DC000000000008040400000000000405DC000000000008040400000000000405DC000000000008040400000000000405DC000000000008040400000000000405DC000000000008040400000000000405DC000000000008040400000000000405DC000000000008040400000000000405DC000000000008040400000000000405DC000000000008040400000000000405DC000000000008040400000000000405DC000000000008040400000000000405DC000000000008040400000000000405DC000000000000040400000000000405DC000000000000040400000000000405DC000000000000040400000000000405DC000000000000040400000000000005DC000000000000040400000000000005DC000000000000040400000000000005DC000000000000040400000000000005DC000000000000040400000000000005DC000000000000040400000000000005DC000000000000040400000000000005DC000000000000040400000000000005DC000000000000040400000000000005DC000000000000040400000000000005DC000000000000040400000000000405DC000000000000040400000000000405DC000000000000040400000000000405DC000000000000040400000000000405DC00000000000004040070000000000000000405DC000000000008040400000000000405DC000000000008040400000000000405DC000000000008040400000000000405DC000000000008040400000000000405DC000000000008040400000000000405DC000000000000040400000000000405DC00000000000804040

query I
SELECT ST_ASTEXT(ST_GEOGFROM('010700000004000000010300000001000000060000000000000000805BC0A6AAAAAAAAAA45400000000000805BC00000000000E0704000000000002059400000000000E070404016B29085AC4D4041BDE94D6F9A6040E6A28B2EBA684240D345175D741157400000000000805BC0A6AAAAAAAAAA4540010300000001000000050000000000000000C06C400000000000C047400000000000C06C40C36DDBB66DDB46C0E6A28B2EBA684240D345175D741157404016B29085AC4D4041BDE94D6F9A60400000000000C06C400000000000C04740010300000001000000060000000000000000C06C40C36DDBB66DDB46C00000000000C06C4000000000008056C00000000000805BC000000000008056C00000000000805BC0A6AAAAAAAAAA4540E6A28B2EBA684240D345175D741157400000000000C06C40C36DDBB66DDB46C00103000000010000000500000000000000002059400000000000E070400000000000C06C400000000000E070400000000000C06C400000000000C047404016B29085AC4D4041BDE94D6F9A604000000000002059400000000000E07040'))
----
GEOMETRYCOLLECTION(POLYGON((-110 43.3333333333333,-110 270,100.5 270,59.3478260869565 132.826086956522,36.8181818181818 92.2727272727273,-110 43.3333333333333)),POLYGON((230 47.5,230 -45.7142857142858,36.8181818181818 92.2727272727273,59.3478260869565 132.826086956522,230 47.5)),POLYGON((230 -45.7142857142858,230 -90,-110 -90,-110 43.3333333333333,36.8181818181818 92.2727272727273,230 -45.7142857142858)),POLYGON((100.5 270,230 270,230 47.5,59.3478260869565 132.826086956522,100.5 270)))

statement error
SELECT ST_GEOGFROM('aaa')

query I
SELECT ST_GEOGFROM(NULL)
----
NULL

query I
SELECT ST_GEOGFROM('')
----
(empty)

#test with invalid input
statement error
SELECT ST_GEOGFROM(22)
