# name: test/sql/function/test_boundary.test
# description: ST_BOUNDARY test
# group: [function]

statement ok
PRAGMA enable_verification

query I
SELECT ST_ASTEXT(ST_Boundary(ST_GeomFromText('POLYGON((234896.5 899456.7,234914 899436.4,234946.6 899356.9,234872.5 899328.7, 234891 899285.4,234992.5 899145, 234890.6 899069,234755.2 899255.4, 234612.7 899379.4,234776.9 899563.7,234896.5 899456.7))', 26986)))
----
LINESTRING(234896.5 899456.7,234914 899436.4,234946.6 899356.9,234872.5 899328.7,234891 899285.4,234992.5 899145,234890.6 899069,234755.2 899255.4,234612.7 899379.4,234776.9 899563.7,234896.5 899456.7)

query I
SELECT ST_AsText(ST_Boundary(ST_GeomFromText('LINESTRING(1 1,0 0, -1 1)')))
----
MULTIPOINT(1 1,-1 1)

query I
SELECT ST_AsText(ST_Boundary(ST_GeomFromText('POLYGON((1 1,0 0, -1 1, 1 1))')))
----
LINESTRING(1 1,0 0,-1 1,1 1)

query I
SELECT ST_astext(ST_boundary('POLYGON((0 0, 0 10, 10 10, 10 0, 0 0),(2 2, 2 4, 4 4, 4 2, 2 2))'::geometry))
----
MULTILINESTRING((0 0,0 10,10 10,10 0,0 0),(2 2,2 4,4 4,4 2,2 2))

query I
SELECT ST_boundary('aaa')
----
NULL

query I
SELECT ST_boundary('')
----
NULL

statement error
SELECT ST_boundary(22)

statement ok
CREATE TABLE geometries(g Geometry)

statement ok
INSERT INTO geometries VALUES('0101000000295C8FC2F5281440E17A14AE47E12540'), ('{"type":"Point","coordinates":[-71.064544,10.2323]}'), ('POLYGON((-71.040878 42.285678,-71.040943 42.2856,-71.04096 42.285752,-71.040878 42.285678))'),(NULL)

query R
select ST_ASTEXT(ST_boundary(g)) from geometries
----
GEOMETRYCOLLECTION EMPTY
GEOMETRYCOLLECTION EMPTY
LINESTRING(-71.040878 42.285678,-71.040943 42.2856,-71.04096 42.285752,-71.040878 42.285678)
NULL

# test with null and empty
statement ok
DELETE FROM geometries

statement ok
INSERT INTO geometries VALUES(''), (NULL)

query R
select ST_ASTEXT(ST_boundary(g)) from geometries
----
NULL
NULL