# name: test/sql/test_point.test
# description: POINT tests
# group: [sql]

statement ok
LOAD 'build/release/extension/geo/geo.duckdb_extension';

statement ok
PRAGMA enable_verification

statement ok
CREATE TABLE geographies (g Geography);

# Insert valid geometry strings
statement ok
INSERT INTO geographies VALUES('01010000008D976E1283C025400000000000004B40'), ('01010000000000000000003E40BBB88D06F0762440'), ('0101000000D200DE0209D651C0F0BF95ECD8A44540'), ('0101000000CB49287D21C451C0F0BF95ECD8A44540')

query T
SELECT * FROM geographies
----
01010000008D976E1283C025400000000000004B40
01010000000000000000003E40BBB88D06F0762440
0101000000D200DE0209D651C0F0BF95ECD8A44540
0101000000CB49287D21C451C0F0BF95ECD8A44540

query T
SELECT ST_ASTEXT(g) FROM geographies
----
POINT(10.876 54)
POINT(30 10.2323)
POINT(-71.3443 43.28787)
POINT(-71.064544 43.28787)

statement error
INSERT INTO geographies(('010100000KCB49287D21C451C0F0BF95ECD8A44540'))

# Insert valid strings with text
statement ok
DELETE FROM geographies

statement ok
INSERT INTO geographies VALUES('POINT(10.876 54)'), ('POINT(-71.064544 42.232)'), ('POINT(-71.3443 43.28787)')

query T
SELECT * FROM geographies
----
01010000008D976E1283C025400000000000004B40
0101000000CB49287D21C451C004560E2DB21D4540
0101000000D200DE0209D651C0F0BF95ECD8A44540

query T
SELECT ST_ASTEXT(g) FROM geographies
----
POINT(10.876 54)
POINT(-71.064544 42.232)
POINT(-71.3443 43.28787)

statement error
INSERT INTO geographies(('PAOINT(-71.064544 42.28787)'))

# Insert valid strings with geojson
statement ok
DELETE FROM geographies

statement ok
INSERT INTO geographies VALUES('{"type":"Point","coordinates":[30.43,10.2]}'), ('{"type":"Point","coordinates":[-71.064544,10.2]}'), ('{"type":"Point","coordinates":[10,43.28787]}')

query T
SELECT * FROM geographies
----
0101000000AE47E17A146E3E406666666666662440
0101000000CB49287D21C451C06666666666662440
01010000000000000000002440F0BF95ECD8A44540

query T
SELECT ST_ASTEXT(g) FROM geographies
----
POINT(30.43 10.2)
POINT(-71.064544 10.2)
POINT(10 43.28787)

# Insert invalid geojson string
statement error
INSERT INTO geographies(('{"type":"Pointttttt","coordinates":[30,10.2323]}'))
