# name: test/sql/test_geometry.test
# description: GEOGRAPHY tests
# group: [sql]

statement ok
LOAD 'build/release/extension/geo/geo.duckdb_extension';

statement ok
PRAGMA enable_verification

statement ok
CREATE TABLE geographies (g Geography);

# Insert valid geography strings
statement ok
INSERT INTO geographies VALUES('010100000000000000000024400000000000004B40'), ('01010000000000000000003E40BBB88D06F0762440'), ('0101000000CB49287D21C451C0F0BF95ECD8244540'), ('0101000000CB49287D21C451C0F0BF95ECD8A44540')

query T
SELECT * FROM geographies
----
0101000020E610000000000000000024400000000000004B40
0101000020E61000000000000000003E40BBB88D06F0762440
0101000020E6100000CB49287D21C451C0F0BF95ECD8244540
0101000020E6100000CB49287D21C451C0F0BF95ECD8A44540

# Insert valid strings with text
statement ok
DELETE FROM geographies

statement ok
INSERT INTO geographies VALUES('POINT(10 54)'), ('POINT(-71.064544 42.28787)'), ('POINT(-71.064544 43.28787)')

query T
SELECT * FROM geographies
----
0101000020E610000000000000000024400000000000004B40
0101000020E6100000CB49287D21C451C0F0BF95ECD8244540
0101000020E6100000CB49287D21C451C0F0BF95ECD8A44540

# Insert valid strings with geojson
statement ok
DELETE FROM geographies

statement ok
INSERT INTO geographies VALUES('{"type":"Point","coordinates":[30,10.2323]}'), ('{"type":"Point","coordinates":[-71.064544,10.2323]}'), ('{"type":"Point","coordinates":[30,43.28787]}')

query T
SELECT * FROM geographies
----
0101000020E61000000000000000003E40BBB88D06F0762440
0101000020E6100000CB49287D21C451C0BBB88D06F0762440
0101000020E61000000000000000003E40F0BF95ECD8A44540

# Insert invalid binary string (invalid hex chars: G, H, I)
statement error
INSERT INTO geographies('010100000000000G0000003E40BBB8HD06F07I2440')

# Insert invalid text string
statement error
INSERT INTO geographies(('PAOINT(-71.064544 42.28787)'))

# Insert invalid geojson string
statement error
INSERT INTO geographies(('{"type":"Pointttttt","coordinates":[30,10.2323]}'))

# GEOGRAPHY null and empty values
query T
SELECT ''::GEOGRAPHY
----
(empty)

query T
SELECT NULL::GEOGRAPHY
----
NULL

statement ok
CREATE TABLE geography_empty (g Geography);

statement ok
INSERT INTO geography_empty VALUES(''), (''::GEOGRAPHY)

statement ok
INSERT INTO geography_empty VALUES(NULL), (NULL::GEOGRAPHY)

query T
SELECT * FROM geography_empty
----
(empty)
(empty)
NULL
NULL