# name: test/sql/function/test_boundary.test
# description: ST_BOUNDARY test
# group: [function]

statement ok
LOAD 'build/release/extension/geo/geo.duckdb_extension';

statement ok
PRAGMA enable_verification

query I
SELECT ST_ASTEXT(ST_Boundary(ST_GeomFromText('POLYGON((-71.1776848522251 42.3902896512902,-71.1776843766326 42.3903829478009,-71.1775844305465 42.3903826677917,-71.1775825927231 42.3902893647987,-71.1776848522251 42.3902896512902))')))
----
LINESTRING(-71.1776848522251 42.3902896512902,-71.1776843766326 42.3903829478009,-71.1775844305465 42.3903826677917,-71.1775825927231 42.3902893647987,-71.1776848522251 42.3902896512902)

query I
SELECT ST_AsText(ST_Boundary(ST_GeomFromText('LINESTRING(1 1,0 0, -1 1)')))
----
MULTIPOINT(1 1,-1 1)

query I
SELECT ST_AsText(ST_Boundary(ST_GeomFromText('POLYGON((1 1,0 0, -1 1, 1 1))')))
----
LINESTRING(1 1,0 0,-1 1,1 1)

query I
SELECT ST_astext(ST_boundary('POLYGON((0 0, 0 10, 10 10, 10 0, 0 0),(2 2, 2 4, 4 4, 4 2, 2 2))'::GEOGRAPHY))
----
MULTILINESTRING((0 0,0 10,10 10,10 0,0 0),(2 2,2 4,4 4,4 2,2 2))

statement error
SELECT ST_boundary('aaa')

query I
SELECT ST_boundary('')
----
(empty)

statement error
SELECT ST_boundary(22)

statement ok
CREATE TABLE geographies(g Geography)

statement ok
INSERT INTO geographies VALUES('0101000000295C8FC2F5281440E17A14AE47E12540'), ('{"type":"Point","coordinates":[-71.064544,10.2323]}'), ('POLYGON((-71.040878 42.285678,-71.040943 42.2856,-71.04096 42.285752,-71.040878 42.285678))'),(NULL)

query R
select ST_ASTEXT(ST_boundary(g)) from geographies
----
GEOMETRYCOLLECTION EMPTY
GEOMETRYCOLLECTION EMPTY
LINESTRING(-71.040878 42.285678,-71.040943 42.2856,-71.04096 42.285752,-71.040878 42.285678)
NULL

# test with null and empty
statement ok
DELETE FROM geographies

statement ok
INSERT INTO geographies VALUES(''), (NULL)

query R
select ST_ASTEXT(ST_boundary(g)) from geographies
----
(empty)
NULL